APPLICATION_ID,ACTIVITY,ADMINISTERING_IC,APPLICATION_TYPE,ARRA_FUNDED,AWARD_NOTICE_DATE,BUDGET_START,BUDGET_END,CFDA_CODE,CORE_PROJECT_NUM,ED_INST_TYPE,FOA_NUMBER,FULL_PROJECT_NUM,FUNDING_ICs,FUNDING_MECHANISM,FY,IC_NAME,NIH_SPENDING_CATS,ORG_CITY,ORG_COUNTRY,ORG_DEPT,ORG_DISTRICT,ORG_DUNS,ORG_FIPS,ORG_IPF_CODE,ORG_NAME,ORG_STATE,ORG_ZIPCODE,PHR,PI_IDS,PI_NAMEs,PROGRAM_OFFICER_NAME,PROJECT_START,PROJECT_END,PROJECT_TERMS,PROJECT_TITLE,SERIAL_NUMBER,STUDY_SECTION,STUDY_SECTION_NAME,SUBPROJECT_ID,SUFFIX,SUPPORT_YEAR,DIRECT_COST_AMT,INDIRECT_COST_AMT,TOTAL_COST,Keyword: Bioinformatics,Keyword: Computational,Keyword: Systems,Keyword: Sum,Keyword: At least one?
9268012,T32,EB,5,N,5/9/2017,5/1/2017,4/30/2018,286,T32EB008389,BIOMED ENGR/COL ENGR/ENGR STA,PA-14-015,5T32EB008389-08,NIBIB:72093\,"TRAINING, INSTITUTIONAL",2017,NATIONAL INSTITUTE OF BIOMEDICAL IMAGING AND BIOENGINEERING,Neurosciences; ,MINNEAPOLIS,UNITED STATES,BIOMEDICAL ENGINEERING,5,555917996,US,1450402,UNIVERSITY OF MINNESOTA,MN,554552070,"PUBLIC HEALTH RELEVANCE: This training program will train doctoral students with a strong, broad foundation in neuroimaging integrating imaging science with neuroscience as well as the interdisciplinary skills needed for the neuroimaging workforce of tomorrow. Trained to be independent researchers/practitioners, the graduates will serve the health care needs of the nation in academics, teaching, industry, government and public service, and make important contributions to the diagnosis and management of disorders of nervous systems.",2272586; ,"CHEN, WEI ;","ERIM, ZEYNEP",5/1/2008,4/30/2020,neuroimaging; Training Programs; ,Integrative Training Program in Neuroimaging,8389,ZEB1,Special Emphasis Panel ,,,8,152196,9294,72093,0,0,1,1,TRUE
9304216,T32,GM,5,N,6/30/2017,7/1/2017,6/30/2018,859,T32GM008185,SCHOOLS OF MEDICINE,PA-11-184,5T32GM008185-30,NIGMS:165485\,"TRAINING, INSTITUTIONAL",2017,NATIONAL INSTITUTE OF GENERAL MEDICAL SCIENCES,Health Disparities; ,LOS ANGELES,UNITED STATES,PHARMACOLOGY,33,92530369,US,577505,UNIVERSITY OF CALIFORNIA LOS ANGELES,CA,900952000,"PUBLIC HEALTH RELEVANCE: The goals of the systems and integrative biology training program at UCLA is to train students to be proficient in both mathematical and biological/medical sciences, in order to help solve sophisticated problems in the increasingly complex world of biomedical research.",1973678; ,"CHOU, TOM ;","NIE, ZHONGZHEN",7/1/1987,6/30/2018,Biology; National Institute of General Medical Sciences; System; ,NIGMS Systems & Integrative Biology,8185,TWD,NIGMS Initial Review Group ,,,30,219414,13605,165485,0,0,2,2,TRUE
9283561,T32,GM,5,N,5/18/2017,7/1/2017,6/30/2018,859,T32GM008450,SCHOOLS OF MEDICINE,PA-11-184,5T32GM008450-24,NIGMS:247889\,"TRAINING, INSTITUTIONAL",2017,NATIONAL INSTITUTE OF GENERAL MEDICAL SCIENCES,Emergency Care; Health Disparities; Injury (total) Accidents/Adverse Effects; ,CHAPEL HILL,UNITED STATES,SURGERY,4,608195277,US,578206,UNIV OF NORTH CAROLINA CHAPEL HILL,NC,275990001,"PUBLIC HEALTH RELEVANCE: Traumatic injury is the leading cause of death for Americans between the ages of 1 and 44, accounting for nearly half of all deaths in this age group, as well as significant long-term complications for many who survive, and the highly-specialized surgical care available at Level 1 trauma centers substantially improves patient survival and recovery from traumatic injury when compared to less specialized treatment. Further advances in the treatment of traumatic injury will require trauma surgeons to actively pursue the research necessary to make new discoveries and develop new systems of care, which is facilitated by adding formal preparation in the methods and application of scientific investigation to their clinical training. The program described herein provides the methodological and experiential groundwork essential for addressing this need.",1922662 (contact); 8817731; ,"CAIRNS, BRUCE A (contact); CHARLES, ANTHONY G;","SOMERS, SCOTT D",7/1/1992,6/30/2019,Fellowship; Trauma Research; ,Trauma Research Fellowship,8450,ZGM1,Special Emphasis Panel ,,,24,233082,14807,247889,0,0,1,1,TRUE
9482485,T32,GM,3,N,5/16/2017,7/1/2016,6/30/2018,859,T32GM007484,SCHOOLS OF ARTS AND SCIENCES,PA-10-036,3T32GM007484-40S1,NIGMS:279669\,"TRAINING, INSTITUTIONAL",2017,NATIONAL INSTITUTE OF GENERAL MEDICAL SCIENCES,Health Disparities; Neurosciences; ,CAMBRIDGE,UNITED STATES,OTHER BASIC SCIENCES,7,1425594,US,4911501,MASSACHUSETTS INSTITUTE OF TECHNOLOGY,MA,21421029,"MIT's Integrative Neuronal Systems program provides interdisciplinary training for graduate students pursuing research careers related to the understanding of the human brain and mind. In addition to graduate coursework, students get hands-on laboratory experience using the latest techniques in neuroscience, including neurophysiology, brain imaging, genetics, molecular biology, and computation.",1928051; ,"DICARLO, JAMES J;","NIE, ZHONGZHEN",7/1/1977,6/30/2018,Neurons; System; ,Integrative Neuronal Systems,7484,BRT,National Institute of General Medical Sciences Initial Review Group ,,S1,40,266064,13605,279669,0,0,2,2,TRUE
9331693,T32,HG,5,N,8/14/2017,9/1/2017,8/31/2018,172,T32HG000035,SCHOOLS OF MEDICINE,PA-14-015,5T32HG000035-23,NHGRI:858205\,"TRAINING, INSTITUTIONAL",2017,NATIONAL HUMAN GENOME RESEARCH INSTITUTE,Genetics; Human Genome; ,SEATTLE,UNITED STATES,GENETICS,7,605799469,US,9087701,UNIVERSITY OF WASHINGTON,WA,981959472,"PUBLIC HEALTH RELEVANCE: Genomics is integral to modern biomedical research and diagnosis. Genome-wide studies are used to identify potential genetic causes of disease, and proteomics is often used to identify biomarkers. Our program will train pre- and postdoctoral trainees for future biomedical and interdisciplinary research in genomics, proteomics, and computational biology.",2238304; ,"SWANSON, WILLIE J;","COLLEY, HEATHER",8/1/1995,8/31/2020,Genome; Science; Training; ,Interdisciplinary Training in Genome Sciences,35,ZHG1,Special Emphasis Panel ,,,23,898361,60726,858205,0,1,0,1,TRUE
9279191,T32,GM,5,N,5/19/2017,7/1/2017,6/30/2018,859,T32GM062754,SCHOOLS OF MEDICINE,PA-11-184,5T32GM062754-17,NIGMS:330348\,"TRAINING, INSTITUTIONAL",2017,NATIONAL INSTITUTE OF GENERAL MEDICAL SCIENCES,Health Disparities; ,NEW YORK,UNITED STATES,PHARMACOLOGY,13,78861598,US,3839801,ICAHN SCHOOL OF MEDICINE AT MOUNT SINAI,NY,100296574,"PUBLIC HEALTH RELEVANCE: Breakthroughs that yield new drugs that ameliorate different human diseases, that yield new diagnostics or new therapeutic strategies, depend more and more upon researchers who apply quantitative computational methods to the complex biology of disease and drug interactions. We aim to foster these skills in talented Ph.D. and MD/Ph.D. students, enabling them to achieve the next generation of breakthroughs.",7013439; ,"SOBIE, ERIC A;","KODURI, SAILAJA",7/5/2001,6/30/2019,Pharmacology; Science; Training; ,Integrated Training in Pharmacological Sciences,62754,TWD,NIGMS Initial Review Group ,,,17,314475,15873,330348,0,1,0,1,TRUE
9460675,T32,HL,3,N,3/30/2017,12/1/2016,3/31/2017,837,T32HL125232,SCHOOLS OF MEDICINE,PA-14-015,3T32HL125232-01A1S1,NHLBI:10252\,"TRAINING, INSTITUTIONAL",2017,"NATIONAL HEART, LUNG, AND BLOOD INSTITUTE",Cardiovascular; Heart Disease; ,BOSTON,UNITED STATES,INTERNAL MEDICINE/MEDICINE,7,604483045,US,894901,BOSTON UNIVERSITY MEDICAL CAMPUS,MA,21182841,"We offer a comprehensive two-year multidisciplinary training program in cardiovascular epidemiology for MDs and PhDs to pursue an academic and scientific research career addressing contemporary training needs of the specialty and using epidemiological databases (including from the Framingham Study) as a foundation. The program will graduate five postdoctoral trainees every two years in three different tracks (translational epidemiological research, statistical genetics-genomics, and bioinformatics-computational biology), with at least 20% underrepresented minorities. We will provide our trainees with multidisciplinary training that includes a broad curriculum to develop core competencies, mentored research projects under the direction of outstanding faculty, comprehensive mentorship, and appropriate career support to facilitate transition to independence.",6195169; ,"RAMACHANDRAN, VASAN S;","SILSBEE, LORRAINE M",4/1/2016,3/31/2021,cardiovascular disorder epidemiology; multidisciplinary; Training Programs; ,Multidisciplinary Training Program in Cardiovascular Epidemiology,125232,NITM,NHLBI Institutional Training Mechanism Review Committee ,,A1S1,1,9493,759,10252,1,1,0,2,TRUE
9270030,T32,EB,5,N,7/6/2017,6/1/2017,5/31/2018,286,T32EB021937,BIOMED ENGR/COL ENGR/ENGR STA,PA-14-015,5T32EB021937-02,NIBIB:189470\,"TRAINING, INSTITUTIONAL",2017,NATIONAL INSTITUTE OF BIOMEDICAL IMAGING AND BIOENGINEERING,Bioengineering; ,NASHVILLE,UNITED STATES,BIOMEDICAL ENGINEERING,5,965717143,US,8721001,VANDERBILT UNIVERSITY,TN,372407749,"PUBLIC HEALTH RELEVANCE: Over the past several decades, dramatic breakthroughs in biomedical science have been witnessed within laboratory research. The ability to translate those discoveries as well as to make new discoveries within human investigations has been a challenge and has been often characterized as the bottleneck of clinical research. We hypothesize that the fundamental bottlenecks associated with clinical translational research can be dramatically loosened with the training of engineers intimately familiar with human treatment and trained in the inception of novel technology-based platforms. The purpose of this training program is to create a new cadre of researchers capable of creating, developing, implementing, clinically evaluating, and translating methods, devices, algorithms, and systems designed with a clear focus at one particular application of medicine, namely, to facilitate surgical/interventiona processes and their outcomes. Thematically, our trainees and training program will have a central focus - innovative platform technologies for treatment and discovery.",1923845; 6706151 (contact); ,"LABADIE, ROBERT F; MIGA, MICHAEL IAN (contact);","ERIM, ZEYNEP",6/1/2016,5/31/2021,Engineering; innovation; Intervention; Operative Surgical Procedures; Research; Training Programs; ,Training Program for Innovative Engineering Research in Surgery and Intervention,21937,ZEB1,Special Emphasis Panel ,,,2,180176,9294,189470,0,0,1,1,TRUE
9390242,T32,MH,3,N,4/27/2017,12/14/2016,6/30/2017,242,T32MH019117,SCHOOLS OF PUBLIC HEALTH,PA-16-287,3T32MH019117-27S1,NIMH:6442\,"TRAINING, INSTITUTIONAL",2017,NATIONAL INSTITUTE OF MENTAL HEALTH,Clinical Research; Health Services; Mental Health; ,CHAPEL HILL,UNITED STATES,PUBLIC HEALTH & PREV MEDICINE,4,608195277,US,578206,UNIV OF NORTH CAROLINA CHAPEL HILL,NC,275990001,PUBLIC HEALTH RELEVANCE: Post-doctoral training is the pipeline to meeting the nation's future public mental health research needs. This postdoctoral program prepares young investigators for careers in mental health services and systems research to develop the knowledge-base for effective services and supports that can help improve the lives of people with serious mental illness.,1899992; ,"DOMINO, MARISA ELENA;","HILL, LAUREN D",12/14/2016,6/30/2017,Health system; Mental Health Services; Research Training; ,Research Training in Mental Health Services and Systems,19117,,,,S1,27,5965,477,6442,0,0,2,2,TRUE
9280928,T32,DK,5,N,6/7/2017,7/1/2017,6/30/2018,847,T32DK007161,SCHOOLS OF MEDICINE,PA-14-015,5T32DK007161-43,NIDDK:194714\,"TRAINING, INSTITUTIONAL",2017,NATIONAL INSTITUTE OF DIABETES AND DIGESTIVE AND KIDNEY DISEASES,Pediatric; ,SAN FRANCISCO,UNITED STATES,PEDIATRICS,12,94878337,US,577508,"UNIVERSITY OF CALIFORNIA, SAN FRANCISCO",CA,941186215,"PUBLIC HEALTH RELEVANCE    Hormonal systems regulate key physiologic processes in virtually all organ systems, and are especially important for growth, reproduction and carbohydrate homeostasis; these are areas addressed by Pediatric Endocrinology. Endocrine disorders include both the common, such as diabetes, obesity, and thyroid disorders, and the very rare. Well-trained Pediatric Endocrine basic science, translational, and clinical investigators are needed to advance this complex and rapidly developing field. This proposal seeks continued funding for one of the oldest and most successful Pediatric Endocrine Fellowship Training Programs, with the aim of continuing to produce innovative scientific and clinical leaders in this field",1899012; ,"GITELMAN, STEPHEN E;","CASTLE, ARTHUR",7/1/1976,6/30/2021,Childhood; Endocrinology; Training Programs; ,Training Program in Pediatric Endocrinology,7161,DDK,"Kidney, Urologic and Hematologic Diseases D Subcommittee ",,,43,203254,15732,194714,0,0,1,1,TRUE
9248415,T32,LM,5,N,3/31/2017,4/1/2017,3/31/2018,879,T32LM012204,SCHOOLS OF MEDICINE,RFA-HG-14-004,5T32LM012204-02,OD:193248\,"TRAINING, INSTITUTIONAL",2017,NATIONAL LIBRARY OF MEDICINE,,HANOVER,UNITED STATES,NONE,2,41027822,US,2021601,DARTMOUTH COLLEGE,NH,37551421,"PUBLIC HEALTH RELEVANCE: Support is requested for a multidisciplinary predoctoral training program in Quantitative Biomedical Sciences (QBS) at Dartmouth College. It is our vision that the next generation of big data researchers need multiple skills and expertise from areas such as bioinformatics, biostatistics, and epidemiology to bring together teams of researchers from diverse fields to tackle the most challenging problems in biomedicine.",1914006; ,"TOSTESON, TOR D;","YE, JANE",4/1/2016,3/31/2021,Science; ,Quantitative Biomedical Sciences at Dartmouth,12204,ZRG1,Special Emphasis Panel ,,,2,183674,9574,193248,1,0,0,1,TRUE
9304284,T32,GM,5,N,6/28/2017,7/1/2017,6/30/2018,859,T32GM100884,SCHOOLS OF MEDICINE,PA-11-184,5T32GM100884-05,NIGMS:165125\,"TRAINING, INSTITUTIONAL",2017,NATIONAL INSTITUTE OF GENERAL MEDICAL SCIENCES,Health Disparities; ,NEW HAVEN,UNITED STATES,PHYSIOLOGY,3,43207562,US,9420201,YALE UNIVERSITY,CT,65208327,"PUBLIC HEALTH RELEVANCE: The past 40 years of biomedical research have witnessed an explosion of cellular, molecular, genetic and biochemical knowledge. However, understanding how each of these molecular and cellular entities participate-both separately and together-in the complex systems that comprise the intact organism has lagged behind. Even more importantly, now that basic understanding of these biological principles has advanced so far, it has become crucial to develop more sophisticated clinical and translational approaches for leveraging this information toward the goal of understanding the molecular mechanisms of disease and developing therapeutics.",1895525; 8259911 (contact); ,"CAPLAN, MICHAEL J.; NITABACH, MICHAEL  (contact);","COLE, ALISON E",7/1/2013,6/30/2018,Molecular Medicine; Training Programs; ,Training Program in Molecular Medicine,100884,TWD,NIGMS Initial Review Group ,,,5,177376,9070,165125,0,0,1,1,TRUE
9307769,T32,DC,5,N,6/6/2017,7/1/2017,6/30/2018,173,T32DC000046,EARTH SCIENCES/RESOURCES,PA-14-015,5T32DC000046-23,NIDCD:166120\,"TRAINING, INSTITUTIONAL",2017,NATIONAL INSTITUTE ON DEAFNESS AND OTHER COMMUNICATION DISORDERS,Minority Health; ,COLLEGE PARK,UNITED STATES,BIOLOGY,5,790934285,US,820102,"UNIV OF MARYLAND, COLLEGE PARK",MD,207425141,"PUBLIC HEALTH RELEVANCE: The CEBH Training Program will continue to provide in-depth and interdisciplinary training in the hearing sciences that prepares individuals to advance discovery and innovation at the interface of basic science and medicine. More complete knowledge of auditory system function promises both to solve some of the most perplexing and devastating problems of human health, and to design pioneering methodologies, systems, and devices that will transform how we live.",1901348 (contact); 1864255; ,"CARR, CATHERINE EMILY (contact); GORDON-SALANT, SANDRA M;","RIVERA-RENTAS, ALBERTO L",7/1/1994,6/30/2020,Biology; comparative; Hearing; ,Comparative and Evolutionary Biology of Hearing,46,ZDC1,Special Emphasis Panel ,,,23,332214,20906,166120,0,0,1,1,TRUE
9307827,T32,ES,5,N,7/10/2017,7/1/2017,6/30/2018,113,T32ES015459,SCHOOLS OF PUBLIC HEALTH,PA-11-184,5T32ES015459-09,NIEHS:672600\,"TRAINING, INSTITUTIONAL",2017,NATIONAL INSTITUTE OF ENVIRONMENTAL HEALTH SCIENCES,,SEATTLE,UNITED STATES,PUBLIC HEALTH & PREV MEDICINE,7,605799469,US,9087701,UNIVERSITY OF WASHINGTON,WA,981959472,Public Health Relevance: The adverse impact of environmental exposures on health is a deep public health concern that can be mitigated through training of the next generation of leaders in quantitative and environmental health sciences.  BEBTEH offers a unique blend of interdisciplinary quantitative and environmental health science training opportunities in first clas research environment. The proposed Training Program will help realize the vision of the 2012 NIEHS Strategic Plan 'to provide global leadership for innovative research that improves public health by preventing diseases and disability.',1941175; ,"SHEPPARD, ELIZABETH A  LIANNE;","SHREFFLER, CAROL A",7/1/2009,6/30/2019,Bioinformatics; Biometry; Environmental Health; Epidemiology; Training; ,"Biostatistics, Epidemiologic & Bioinformatic Training in Environmental Health",15459,EHS,Environmental Health Sciences Review Committee ,,,9,635044,37556,672600,1,0,0,1,TRUE
9386311,T32,DK,1,N,8/31/2017,9/1/2017,8/31/2018,847,T32DK110919,,PAR-15-182,1T32DK110919-01A1,NIDDK:139986\,"TRAINING, INSTITUTIONAL",2017,NATIONAL INSTITUTE OF DIABETES AND DIGESTIVE AND KIDNEY DISEASES,Diabetes; Nutrition; Obesity; ,BOSTON,UNITED STATES,,8,73130411,US,4907701,MASSACHUSETTS GENERAL HOSPITAL,MA,21142696,"NARRATIVE Technological and analytical advances have generated enormous data sets with information relevant to type 2 diabetes, obesity and related metabolic traits. There is an urgent need to attract investigators experienced in mathematics, statistics, computational biology and bioinformatics to the analysis and interpretations of such data, and to equip investigators with an interest in these phenotypes with the tools and skills required to extract valuable knowledge. This training grant will leverage complementary expertise across several Harvard-affiliated institutions by pairing selected trainees with faculty mentors who can provide rigorous training in a multidisciplinary setting pertinent to this disease area.",1911463 (contact); 9643320; ,"FLOREZ, JOSE CARLOS (contact); PATEL, CHIRAG J.;","CASTLE, ARTHUR",9/1/2017,8/31/2022,Bioinformatics; Diabetes Mellitus; Metabolism; Obesity; Training Programs; ,"Harvard Training Program in Bioinformatics Applied to Diabetes, Obesity and Metabolism.",110919,ZDK1,Special Emphasis Panel ,,A1,1,130084,9902,139986,3,1,0,4,TRUE
9397684,T32,MH,3,N,1/19/2017,12/10/2016,6/30/2017,242,T32MH020065,SCHOOLS OF MEDICINE,PA-16-287,3T32MH020065-14S1,NIMH:3024\,"TRAINING, INSTITUTIONAL",2017,NATIONAL INSTITUTE OF MENTAL HEALTH,Mental Health; ,CHICAGO,UNITED STATES,GENETICS,1,5421136,US,1413601,UNIVERSITY OF CHICAGO,IL,606375418,"PUBLIC HEALTH RELEVANCE: The mission of the 'Training in Emerging Multidisciplinary Approaches to Mental Health and Disease' training program is to train pre- and post-doctoral students in the methodology that will be important for the next generation of progress in understanding the genetics of psychiatric health and disease. The program will emphasize the integration of computational and statistical approaches to complex datasets as well as the use of hypothesis driven laboratory-based experimental approaches. Trainees will be prepared for the coming decade, which will see an acceleration of the trend towards multidisciplinary science.",8575407; 3054054 (contact); ,"NICOLAE, DAN LIVIU; RZHETSKY, ANDREY  (contact);","VAN'T VEER, ASHLEE V",12/10/2016,6/30/2017,Disease; interdisciplinary approach; Mental Health; Training; ,Training in Emerging Multidisciplinary Approaches to Mental Health and Disease,20065,,,,S1,14,2800,224,3024,0,1,0,1,TRUE
9387669,T32,MH,3,N,5/9/2017,12/1/2016,6/30/2017,242,T32MH106454,SCHOOLS OF ARTS AND SCIENCES,PA-16-287,3T32MH106454-02S1,NIMH:3072\,"TRAINING, INSTITUTIONAL",2017,NATIONAL INSTITUTE OF MENTAL HEALTH,Mental Health; ,AUSTIN,UNITED STATES,NEUROSCIENCES,10,170230239,US,578403,"UNIVERSITY OF TEXAS, AUSTIN",TX,787595316,"PUBLIC HEALTH RELEVANCE: The goal of the proposed training program is to offer the highest caliber pre- and postdoctoral training to position our students to become innovative leaders in the field of learning and memory. Impairments in learning and memory are characteristic of several mental health disorders, including schizophrenia, depression, and post-traumatic stress disorder. As such, there remains an urgent need to understand the brain mechanisms that underlie learning and memory in an effort to aid the development of effective treatment interventions for psychiatric and neurological disorders that require acquisition and maintenance of new behaviors. The skills required to obtain this goal is increasingly involve complex and state-of-the-art techniques, including cross-disciplinary experimental approaches and sophisticated computational techniques. The strengths of the talented and highly collaborative CLM faculty match these needs and are well suited to train the next generation of scientists that will lead this field in the 21st century.",1960889; ,"MAUK, MICHAEL D;","VAN'T VEER, ASHLEE V",12/1/2016,6/30/2017,Learning; Memory; Training; ,Training in Learning and Memory,106454,,,,S1,2,2844,228,3072,0,1,0,1,TRUE
9207557,T32,HL,2,N,12/30/2016,7/1/2017,6/30/2018,837,T32HL007284,SCHOOLS OF MEDICINE,PA-14-015,2T32HL007284-41,NHLBI:818334\,"TRAINING, INSTITUTIONAL",2017,"NATIONAL HEART, LUNG, AND BLOOD INSTITUTE",Cardiovascular; ,CHARLOTTESVILLE,UNITED STATES,PHYSIOLOGY,5,65391526,US,1526402,UNIVERSITY OF VIRGINIA,VA,229044195,"Project Narrative/Relevance:  In spite of decades of research and expenditure of billions of dollars cardiovascular disease (CVD) remains the leading cause of death worldwide and is increasing in incidence largely as a consequence of global Westernization with subsequent epidemics in obesity, metabolic disease, and diabetes, all of which greatly exacerbate CVD. A central premise of this cardiovascular research training program (CVTP) is that these diseases are extremely complex, and that rigorous study of them requires trainees to have a strong foundation of knowledge in basic CV physiology, developmental biology, genetics, genomics, bioinformatics, epigenetics, pathology, systems biology, biomedical engineering, and many other disciplines. The goal of this training program is to provide both pre- and post-doctoral trainees a highly integrated training experience to enable them to be facile in all of these disciplines thus uniquely enabling them to conduct pioneering studies of the pathogenesis of CVD, and to contribute to development of innovative and much more effective ways to treat or prevent them.          ",6398572; ,"OWENS, GARY K;","SCOTT, JANE",7/1/1977,6/30/2022,Cardiovascular system; Grant; Research Training; ,Basic Cardiovascular Research Training Grant,7284,NITM,NHLBI Institutional Training Mechanism Review Committee ,,,41,767198,51136,818334,1,0,1,2,TRUE
9301648,T32,MH,5,N,4/28/2017,7/1/2017,6/30/2018,242,T32MH020065,SCHOOLS OF MEDICINE,PA-11-184,5T32MH020065-15,NIMH:281785\,"TRAINING, INSTITUTIONAL",2017,NATIONAL INSTITUTE OF MENTAL HEALTH,Mental Health; ,CHICAGO,UNITED STATES,GENETICS,1,5421136,US,1413601,UNIVERSITY OF CHICAGO,IL,606375418,"PUBLIC HEALTH RELEVANCE: The mission of the 'Training in Emerging Multidisciplinary Approaches to Mental Health and Disease' training program is to train pre- and post-doctoral students in the methodology that will be important for the next generation of progress in understanding the genetics of psychiatric health and disease. The program will emphasize the integration of computational and statistical approaches to complex datasets as well as the use of hypothesis driven laboratory-based experimental approaches. Trainees will be prepared for the coming decade, which will see an acceleration of the trend towards multidisciplinary science.",8575407; 3054054 (contact); ,"NICOLAE, DAN LIVIU; RZHETSKY, ANDREY  (contact);","VAN'T VEER, ASHLEE V",7/11/2002,6/30/2018,Disease; interdisciplinary approach; Mental Health; Training; ,Training in Emerging Multidisciplinary Approaches to Mental Health and Disease,20065,ZMH1,Special Emphasis Panel ,,,15,263282,18503,281785,0,1,0,1,TRUE
9279333,T32,GM,2,N,6/30/2017,7/1/2017,6/30/2018,859,T32GM008764,BIOMED ENGR/COL ENGR/ENGR STA,PA-16-152,2T32GM008764-16,NIGMS:372892\,"TRAINING, INSTITUTIONAL",2017,NATIONAL INSTITUTE OF GENERAL MEDICAL SCIENCES,Health Disparities; ,BOSTON,UNITED STATES,ENGINEERING (ALL TYPES),7,49435266,US,10001093,BOSTON UNIVERSITY (CHARLES RIVER CAMPUS),MA,22151390,"This proposal seeks another five years of support to continue and enhance our established predoctoral-student training program in Quantitative Biology and Physiology (QBP). The mission of the QBP Program is to train PhD research scientists who have: (1) a quantitatively based understanding of the principles underlying molecular biology, cell biology and physiology; (2) the capacity to synthesize modern and quantitatively driven experimental methods with biology and physiology; (3) the ability to synthesize mechanistically and structurally based modeling skills with biological and physical systems; and (4) the capacity to assess emergent properties and behavior via integration across multiple length scales of a biological or physiological system or process.",1901370; ,"WHITE, JOHN A.;","NIE, ZHONGZHEN",7/1/2001,6/30/2022,Biology; Physiology; Training Programs; ,Training Program in Quantitative Biology and Physiology,8764,TWD,NIGMS Initial Review Group ,,,16,354752,18140,372892,0,0,1,1,TRUE
