9088492,T32,HL,4,N,7/25/2016,9/1/2016,8/31/2017,837,T32HL091823,SCHOOLS OF MEDICINE,PA-11-184,4T32HL091823-09,NHLBI:164863\,"TRAINING, INSTITUTIONAL",2016,"NATIONAL HEART, LUNG, AND BLOOD INSTITUTE",,SAINT LOUIS,UNITED STATES,BIOSTATISTICS & OTHER MATH SCI,1,68552207,US,9083901,WASHINGTON UNIVERSITY,MO,631304862,"This renewal application for Post-Doctoral Research Training in Genetic Epidemiology is requesting funds for continued support of 4 post-doc slots each year for 5 years. Trainees will come with an MD or MD/PhD or a PhD degree. Half of the trainees will complete a master's degree and receive in-depth training in genetic epidemiology, statistical genetics, and bioinformatics. The centerpiece of this young program is an Individualized Training Pathway (ITP), customized around the strengths and weaknesses of each trainee.",1876485; ,"RAO, DABEERU C;","SILSBEE, LORRAINE M",9/15/2008,8/31/2018,genetic epidemiology; Postdoctoral Fellow; Research Training; ,Post-Doctoral Research Training in Genetic Epidemiology,91823,NITM,NHLBI Institutional Training Mechanism Review Committee ,,,9,272288,19575,164863,1,0,0,1,TRUE
9063131,T32,GM,5,N,5/25/2016,7/1/2016,6/30/2017,859,T32GM062754,SCHOOLS OF MEDICINE,PA-11-184,5T32GM062754-16,NIGMS:280122\,"TRAINING, INSTITUTIONAL",2016,NATIONAL INSTITUTE OF GENERAL MEDICAL SCIENCES,,NEW YORK,UNITED STATES,PHARMACOLOGY,13,78861598,US,3839801,ICAHN SCHOOL OF MEDICINE AT MOUNT SINAI,NY,100296574,"PUBLIC HEALTH RELEVANCE: Breakthroughs that yield new drugs that ameliorate different human diseases, that yield new diagnostics or new therapeutic strategies, depend more and more upon researchers who apply quantitative computational methods to the complex biology of disease and drug interactions. We aim to foster these skills in talented Ph.D. and MD/Ph.D. students, enabling them to achieve the next generation of breakthroughs.",7013439; ,"SOBIE, ERIC A;","KODURI, SAILAJA",7/5/2001,6/30/2019,Science; Training; ,Integrated Training in Pharmacological Sciences,62754,TWD,NIGMS Initial Review Group ,,,16,266742,13380,280122,0,1,0,1,TRUE
9073677,T32,DK,2,N,5/26/2016,7/1/2016,6/30/2017,847,T32DK007161,SCHOOLS OF MEDICINE,PA-14-015,2T32DK007161-42,NIDDK:153135\,"TRAINING, INSTITUTIONAL",2016,NATIONAL INSTITUTE OF DIABETES AND DIGESTIVE AND KIDNEY DISEASES,Pediatric; ,SAN FRANCISCO,UNITED STATES,PEDIATRICS,12,94878337,US,577508,"UNIVERSITY OF CALIFORNIA, SAN FRANCISCO",CA,941186215,"PUBLIC HEALTH RELEVANCE     Hormonal systems regulate key physiologic processes in virtually all organ systems, and are especially important for growth, reproduction and carbohydrate homeostasis; these are areas addressed by Pediatric Endocrinology. Endocrine disorders include both the common, such as diabetes, obesity, and thyroid disorders, and the very rare. Well-trained Pediatric Endocrine basic science, translational, and clinical investigators are needed to advance this complex and rapidly developing field. This proposal seeks continued funding for one of the oldest and most successful Pediatric Endocrine Fellowship Training Programs, with the aim of continuing to produce innovative scientific and clinical leaders in this field",1899012; ,"GITELMAN, STEPHEN E;","CASTLE, ARTHUR",7/1/1976,6/30/2021,Childhood; Endocrinology; Training Programs; ,Training Program in Pediatric Endocrinology,7161,DDK,"Kidney, Urologic and Hematologic Diseases D Subcommittee ",,,42,198096,15307,153135,0,0,1,1,TRUE
9086886,T32,NS,9,N,6/21/2016,7/1/2016,6/30/2017,853,T32NS096050,SCHOOLS OF MEDICINE,PAR-15-178,9T32NS096050-21,NIDA:46592\NIGMS:186368\NINDS:93185\,"TRAINING, INSTITUTIONAL",2016,NATIONAL INSTITUTE OF NEUROLOGICAL DISORDERS AND STROKE,Drug Abuse (NIDA only); Neurosciences; Substance Abuse; ,ATLANTA,UNITED STATES,NEUROLOGY,5,66469933,US,2384501,EMORY UNIVERSITY,GA,303224250,"PUBLIC HEALTH RELEVANCE:  This proposal is a competing renewal to support the training of ten pre-doctoral students enrolled in the PhD graduate neuroscience program at Emory University during years 1 or 2 of training. The interdisciplinary Emory neuroscience program comprises a total of 96 training faculty and 94 PhD students involved in neuroscience research that cuts across a wide array of disciplines that range from the understanding of basic neural communication to the treatment of complex neurological and psychiatric disorders. The pool of applicants (including underrepresented minority groups) has constantly raised during the past funding period, while remaining of outstanding quality. Therefore the present application requests the number of slots supported by this training grant to be raised from7 to 10 for the next funding period.",2104611; ,"SMITH, YOLAND ;","WEIGAND, LETITIA ALEXIS",7/1/1996,6/30/2021,Biology; Neurosciences; System; Training; ,Training In Systems And Integrative Biology Neuroscience,96050,ZNS1,Special Emphasis Panel ,,,21,310282,15863,326145,0,0,1,1,TRUE
9060328,T32,GM,5,N,6/24/2016,7/1/2016,6/30/2017,859,T32GM007229,SCHOOLS OF MEDICINE,PA-11-184,5T32GM007229-40,NIGMS:461061\,"TRAINING, INSTITUTIONAL",2016,NATIONAL INSTITUTE OF GENERAL MEDICAL SCIENCES,,PHILADELPHIA,UNITED STATES,ANATOMY/CELL BIOLOGY,2,42250712,US,6463801,UNIVERSITY OF PENNSYLVANIA,PA,191046205,"PUBLIC HEALTH RELEVANCE: This Predoctoral Training Program includes education and research opportunities to investigate the molecular and cellular basis of fundamental biological processes that range from cell signaling to gene expression, employing a wide array of model systems.",1883128 (contact); 1876102; ,"BARTOLOMEI, MARISA S. (contact); SCHULTZ, RICHARD M;","GINDHART, JOSEPH G",7/1/1975,6/30/2019,Cellular biology; Molecular Biology; Training Programs; ,Training Program in Cell and Molecular Biology,7229,TWD,NIGMS Initial Review Group ,,,40,438760,22301,461061,0,0,1,1,TRUE
9127229,T32,EB,5,N,8/4/2016,9/1/2016,8/31/2017,286,T32EB009419,SCHOOLS OF ARTS AND SCIENCES,PA-11-184,5T32EB009419-08,NIBIB:281172\,"TRAINING, INSTITUTIONAL",2016,NATIONAL INSTITUTE OF BIOMEDICAL IMAGING AND BIOENGINEERING,,WALTHAM,UNITED STATES,BIOCHEMISTRY,5,616845814,US,925301,BRANDEIS UNIVERSITY,MA,24532728,"PUBLIC HEALTH RELEVANCE: The goal of the Quantitative Biology program is to train Ph.D. scientists who are well equipped to bring quantitative experimental, computational, and mathematical methods to bear on important problems in biomedical research. It is anticipated that the work of these scientists will lead to improvements in public health by advancing basic biomedical research in directions that are not readily accessible to scientists who lack interdisciplinary training.",1858704 (contact); 8797428; ,"GELLES, JEFF  (contact); KONDEV, JANE ;","BAIRD, RICHARD A",7/1/2009,8/31/2019,Biology; ,Quantitative Biology,9419,ZEB1,Special Emphasis Panel ,,,8,267456,13716,281172,0,1,0,1,TRUE
9072724,T32,CA,2,N,8/1/2016,8/1/2016,7/31/2017,398,T32CA009337,SCHOOLS OF PUBLIC HEALTH,PA-14-015,2T32CA009337-36,NCI:523733\,"TRAINING, INSTITUTIONAL",2016,NATIONAL CANCER INSTITUTE,Cancer; ,BOSTON,UNITED STATES,BIOSTATISTICS & OTHER MATH SCI,7,149617367,US,3212904,HARVARD SCHOOL OF PUBLIC HEALTH,MA,21156028,"PUBLIC HEALTH RELEVANCE: The training program is to train students and postdoctoral fellows to be high quality quantitative researchers who are capable of conducting cutting edge methodological and collaborative research in cancer clinical trials, computational biology, cancer genomics, cancer epidemiology and population science. Also, the program trains quantitative researchers to become strong team leaders/players as well as excellent communicators in a cancer research environment, and to enable them to effectively disseminate their research results and to assume active roles in the design, analysis and interpretation of, for example, cancer genomic studies, cancer clinical trials and cancer prevention trials.",6473085; ,"PARMIGIANI, GIOVANNI LUIGI;","PERKINS, SUSAN N",6/1/1979,7/31/2021,anticancer research; Grant; Science; Training; ,Training Grant in Quantitative Sciences for Cancer Research,9337,NCI,Subcommittee I - Transistion to Independence ,,,36,497302,26984,523733,0,1,0,1,TRUE
9097778,T32,HG,4,N,6/24/2016,7/1/2016,6/30/2017,172,T32HG002760,GRADUATE SCHOOLS,PA-11-184,4T32HG002760-14,NHGRI:734936\,"TRAINING, INSTITUTIONAL",2016,NATIONAL HUMAN GENOME RESEARCH INSTITUTE,Genetics; Human Genome; ,MADISON,UNITED STATES,MISCELLANEOUS,2,161202122,US,578503,UNIVERSITY OF WISCONSIN-MADISON,WI,537151218,PUBLIC HEALTH RELEVANCE: Modern medical practice is now relying on the fruits of genomic research for analyzing the genetic makeup of patients and their cancers. New medical treatments are increasingly being tailored to individual patients for increasing their effectivenes and lessening side-effects. We propose to train scientists who will be developing the systems and analysis that will enable greater use of genomic information for biomedical researchers and the general public when they see a doctor.,1894740; ,"SCHWARTZ, DAVID C.;","COLLEY, HEATHER",7/1/2003,6/30/2018,Genomics; Grant; Science; Training; ,Institutional Training Grant in the Genomic Sciences,2760,GNOM,National Human Genome Research Institute Initial Review Group ,,,14,733678,45735,734936,0,0,1,1,TRUE
9047219,T32,AI,4,N,5/27/2016,8/1/2016,7/31/2017,855,T32AI007508,SCHOOLS OF MEDICINE,PA-11-184,4T32AI007508-19,NIAID:181175\,"TRAINING, INSTITUTIONAL",2016,NATIONAL INSTITUTE OF ALLERGY AND INFECTIOUS DISEASES,,MAYWOOD,UNITED STATES,MICROBIOLOGY/IMMUN/VIROLOGY,7,791277940,US,4689203,LOYOLA UNIVERSITY CHICAGO,IL,601533328,PUBLIC HEALTH RELEVANCE: We study host-microbe interactions using three different model systems. Results from the studies are expected to identify means to enhance immunity in neonates and in the elderly and also to identify reagents that can prevent and/or down-regulate disease caused by infectious diseases.,1870646; ,"KNIGHT, KATHERINE L.;","GONDRE-LEWIS, TIMOTHY A",8/1/1997,7/31/2018,Grant; Immunology; Training; ,Experimental Immunology Training Grant,7508,AITC,"Allergy, Immunology, and Transplantation Research Committee ",,,19,178304,9144,181175,0,0,1,1,TRUE
9073347,T32,EY,2,N,7/18/2016,7/1/2016,6/30/2017,867,T32EY021453,SCHOOLS OF MEDICINE,PA-14-015,2T32EY021453-06,NEI:111097\,"TRAINING, INSTITUTIONAL",2016,NATIONAL EYE INSTITUTE,Eye Disease and Disorders of Vision; Genetics; Human Genome; ,NASHVILLE,UNITED STATES,NONE,5,965717143,US,8721001,VANDERBILT UNIVERSITY,TN,372407749,PUBLIC HEALTH RELEVANCE     This training program for both predoctoral and postdoctoral fellows will provide training in statistical genetics and genome bioinformatics with an emphasis on their applications to the biology of ocular disease. Trainees will be provided an integrated environment affording specific training in both clinical and genomic aspects of quantitative ocular phenotypes.,8017255 (contact); 3075104; ,"BRANTLEY, MILAM A (contact); COX, NANCY J;","AGARWAL, NEERAJ",2/1/2011,6/30/2021,Genomics; Training Programs; ,Training Program in Quantitative Ocular Genomics,21453,ZEY1,Special Emphasis Panel ,,,6,112446,8996,111097,1,0,0,1,TRUE
9102086,T32,ES,4,N,7/12/2016,7/12/2016,6/30/2019,113,T32ES013678,SCHOOLS OF MEDICINE,PA-11-184,4T32ES013678-10,NIEHS:408383\,"TRAINING, INSTITUTIONAL",2016,NATIONAL INSTITUTE OF ENVIRONMENTAL HEALTH SCIENCES,Genetics; Human Genome; ,LOS ANGELES,UNITED STATES,PUBLIC HEALTH & PREV MEDICINE,34,72933393,US,7636101,UNIVERSITY OF SOUTHERN CALIFORNIA,CA,900331036,"PROJECT NARRATIVE This is a renewal of our T-32 training grant in 'Environmental Genomics,' aimed at providing multidisciplinary education and research training for five predoctoral and three postdoctoral trainees. For PhD candidates, our program involves a rigorous program of course work based on our existing PhD degree programs in Epidemiology, Molecular Epidemiology, Statistical Genetics & Genetic Epidemiology, and Biostatistics, with a well defined set of core knowledge aimed a bridging these various fields. At the post-doctoral level, the emphasis is on research experience within one of the leading research departments in the country, with extensive portfolios of grant support in environmental epidemiology, genetics, biostatistics, and bioinformatics and superb faculty for mentorship. Our goal is to position our trainees for leadership positions in this rapidly evolving field, by bringing together expertise in field studies, molecular techniques, and statistical and bioinformatic tools.",1964858 (contact); 7596471; ,"GAUDERMAN, WILLIAM JAMES (contact); MCCONNELL, ROB S;","SHREFFLER, CAROL A",7/1/2006,6/30/2019,Genomics; ,Environmental Genomics,13678,EHS,Environmental Health Sciences Review Committee ,,,10,383686,24697,408383,1,0,0,1,TRUE
8997095,T32,EY,4,N,12/14/2015,1/1/2016,12/31/2016,867,T32EY023194,SCHOOLS OF MEDICINE,RFA-EY-10-001,4T32EY023194-04,NEI:151205\,"TRAINING, INSTITUTIONAL",2016,NATIONAL EYE INSTITUTE,Eye Disease and Disorders of Vision; Genetics; Human Genome; ,CORAL GABLES,UNITED STATES,GENETICS,27,52780918,US,5221250,UNIVERSITY OF MIAMI SCHOOL OF MEDICINE,FL,331462926,"PUBLIC HEALTH RELEVANCE: Many common diseases of the visual system, such as macular degeneration and glaucoma, are now known to be caused by a complex web of genetic and environmental factors. Modern technology now allows scientists to generate very large data sets with information about all the genes and proteins in the eye. Analyzing such data sets to understand what causes eye disease requires scientists trained in both computational genomics and vision science; this program, located at one of the premier institutions for human genetics and ophthalmologic research, addresses that need for training scientists in this area.",2190847; ,"SCOTT, WILLIAM K;","AGARWAL, NEERAJ",1/1/2013,12/31/2017,Genomics; Training Programs; Universities; ,University of Miami Computational Ocular Genomics Training Program,23194,ZEY1,Special Emphasis Panel ,,,4,145646,9092,151205,0,2,0,2,TRUE
9119731,T32,AA,4,N,8/5/2016,9/1/2016,8/31/2017,273,T32AA007567,SCHOOLS OF SOCIAL WELFARE/WORK,PA-11-184,4T32AA007567-23,NIAAA:193400\,"TRAINING, INSTITUTIONAL",2016,NATIONAL INSTITUTE ON ALCOHOL ABUSE AND ALCOHOLISM,"Alcoholism, Alcohol Use and Health; Clinical Research; Health Services; Substance Abuse; ",WALTHAM,UNITED STATES,MISCELLANEOUS,5,616845814,US,925301,BRANDEIS UNIVERSITY,MA,24532728,"Alcohol-related services research can lead to improved systems for prevention and treatment services, enhancing quality, and reducing the adverse consequences of alcohol use disorders. Training the next generation of alcohol services researchers continues to be crucial because of the continued magnitude of alcohol problems in the US, and the complexity of the alcohol prevention and treatment systems.",1878150; ,"HORGAN, CONSTANCE M.;","DUCHARME, LORI",9/15/1994,8/31/2017,alcohol related problem; Health Services Research; Training; ,Doctoral Training/Health Services Research on Alcohol-Related Problems,7567,ZAA1,Special Emphasis Panel ,,,23,266856,13668,193400,0,0,1,1,TRUE
9068151,T32,GM,4,N,6/27/2016,7/1/2016,6/30/2017,859,T32GM008764,BIOMED ENGR/COL ENGR/ENGR STA,PA-11-184,4T32GM008764-15,NIGMS:216345\,"TRAINING, INSTITUTIONAL",2016,NATIONAL INSTITUTE OF GENERAL MEDICAL SCIENCES,,BOSTON,UNITED STATES,ENGINEERING (ALL TYPES),7,49435266,US,10001093,BOSTON UNIVERSITY (CHARLES RIVER CAMPUS),MA,22151390,"PUBLIC HEALTH RELEVANCE: This proposal seeks another five years of support to continue and enhance our established predoctoral-student training program in Quantitative Biology and Physiology (QBP). The mission of the QBP Program is to train PhD research scientists who have: (1) a quantitatively based understanding of the principles underlying molecular biology, cell biology and physiology; (2) the capacity to synthesize modern and quantitatively driven experimental methods with biology and physiology; (3) the ability to synthesize mechanistically and structurally based modeling skills with biological and physical systems; and (4) the capacity to assess emergent properties and behavior via integration across multiple levels (molecular-cellular-tissue-organ) of a biological or physiological system or process.",2091482; ,"BIGIO, IRVING J;","NIE, ZHONGZHEN",7/1/2001,6/30/2017,Biology; Training Programs; ,Training Program in Quantitative Biology andPhysiology,8764,BRT,National Institute of General Medical Sciences Initial Review Group ,,,15,307132,15611,216345,0,0,1,1,TRUE
9148168,T32,CA,5,N,8/15/2016,9/1/2016,8/31/2017,398,T32CA078207,SCHOOLS OF MEDICINE,PA-14-015,5T32CA078207-17,NCI:507918\,"TRAINING, INSTITUTIONAL",2016,NATIONAL CANCER INSTITUTE,Cancer; ,NEW YORK,UNITED STATES,INTERNAL MEDICINE/MEDICINE,13,78861598,US,3839801,ICAHN SCHOOL OF MEDICINE AT MOUNT SINAI,NY,100296574,"PUBLIC HEALTH RELEVANCE: Cancer biology research within this institutional, multidisciplinary training program is aimed at elucidating the molecular mechanisms responsible for initiation and progression of human cancer. Translational research is also directed at improving diagnosis and therapies for this terrible disease, and our training faculty have made discoveries that have led to new cancer therapies. Both pre- and postdoctoral trainees participate in rigorous didactic as well as state-of-the-art laboratory and/or computational research training with the earliest cadre having now established academic careers in cancer research.",1967818; ,"AARONSON, STUART A.;","LIM, SUSAN E",7/20/1999,8/31/2020,Cancer Biology; Training Programs; ,Training Program in Cancer Biology,78207,NCI,Subcommittee I - Transistion to Independence ,,,17,474450,33468,507918,0,1,0,1,TRUE
9058921,T32,AG,5,N,5/10/2016,5/1/2016,4/30/2017,866,T32AG000246,SCHOOLS OF ARTS AND SCIENCES,PA-11-184,5T32AG000246-22,NIA:179831\,"TRAINING, INSTITUTIONAL",2016,NATIONAL INSTITUTE ON AGING,Aging; ,BERKELEY,UNITED STATES,SOCIAL SCIENCES,13,124726725,US,577502,UNIVERSITY OF CALIFORNIA BERKELEY,CA,947045940,"PUBLIC HEALTH RELEVANCE:  Population aging raises the prevalence of aging related illnesses and behaviors, and thereby stresses public and private support systems for the elderly including Medicare, Institutional Medicaid, Social Security, familial care of the elderly, and so o. Economic behavior regarding labor supply and retirement at older ages, saving and dissaving, financial decision making, and living arrangements is also highly relevant. The proposed training program deals with these issues.",10801361; ,"GOLDSTEIN, JOSHUA R.;","PATMIOS, GEORGEANNE E",8/15/1995,4/30/2019,Aging; Demography; Economics; Training; ,Training in the Demography and Economics of Aging,246,ZAG1,Special Emphasis Panel ,,,22,170767,9064,179831,0,0,1,1,TRUE
9118992,T32,EB,5,N,8/1/2016,8/1/2016,7/31/2017,286,T32EB009403,SCHOOLS OF ARTS AND SCIENCES,PA-11-184,5T32EB009403-08,NIBIB:260440\,"TRAINING, INSTITUTIONAL",2016,NATIONAL INSTITUTE OF BIOMEDICAL IMAGING AND BIOENGINEERING,Networking and Information Technology R&D; ,PITTSBURGH,UNITED STATES,BIOLOGY,14,52184116,US,247601,CARNEGIE-MELLON UNIVERSITY,PA,152133815,"PUBLIC HEALTH RELEVANCE: Biomedical research has become a data-intensive field that depends on researchers with sophisticated knowledge of both computational and biomedical sciences. By training a core of exceptionally talented students in these skills, the proposed work will help advance numerous directions in improving medical treatment that now critically depend on computational innovation, such as medical image analysis, personalized and genomic medicine, and modern drug design.",6906070; 8019070; 1901077; 6715549 (contact); ,"BAHAR, IVET ; BENOS, PANAGIOTIS V; MURPHY, ROBERT F.; SCHWARTZ, RUSSELL S (contact);","BAIRD, RICHARD A",4/1/2009,7/31/2019,Computational Biology; programs; Universities; ,"Integrated, Interdisciplinary, Inter-university PHD Program Computational Biology",9403,ZEB1,Special Emphasis Panel ,,,8,267456,13716,260440,0,3,0,3,TRUE
9115584,T32,EB,5,N,6/23/2016,7/1/2016,6/30/2017,286,T32EB000809,SCHOOLS OF MEDICINE,PA-11-184,5T32EB000809-13,NIBIB:184287\,"TRAINING, INSTITUTIONAL",2016,NATIONAL INSTITUTE OF BIOMEDICAL IMAGING AND BIOENGINEERING,Bioengineering; Diagnostic Radiology; ,TUCSON,UNITED STATES,RADIATION-DIAGNOSTIC/ONCOLOGY,3,806345617,US,490201,UNIVERSITY OF ARIZONA,AZ,857210158,"PUBLIC HEALTH RELEVANCE: Biomedical Imaging and Spectroscopy (BMIS) is a pre-doctoral training program at the University of Arizona intended to train the next generation of interdisciplinary scientists who can create, adapt, develop, and apply imaging and spectroscopy systems, tools, and methods, to important biomedical problems.",6829151; ,"GMITRO, ARTHUR F.;","BAIRD, RICHARD A",5/1/2003,6/30/2019,bioimaging; spectroscopic imaging; Training; ,Graduate Training in Biomedical Imaging and Spectroscopy,809,ZEB1,Special Emphasis Panel ,,,13,174804,13716,184287,0,0,1,1,TRUE
9073367,T32,GM,2,N,6/27/2016,7/1/2016,6/30/2017,859,T32GM008322,SCHOOLS OF MEDICINE,PA-14-015,2T32GM008322-26,NIGMS:276636\,"TRAINING, INSTITUTIONAL",2016,NATIONAL INSTITUTE OF GENERAL MEDICAL SCIENCES,,ANN ARBOR,UNITED STATES,PHYSIOLOGY,12,73133571,US,1506502,UNIVERSITY OF MICHIGAN AT ANN ARBOR,MI,481091276,"PUBLIC HEALTH RELEVANCE     This training grant will prepare the next generation of research scientists to tackle a range of questions and challenges in cellular, molecular and integrative biology that build on quantitative and computational analyses of complex data sets, including those generated by large scale genome sequencing, proteomics and metabolomics. These scientists will contribute to the discovery of new mechanisms and treatments for chronic diseases. They will be prepared for successful careers in a variety of settings including academic, commercial, governmental, and policy institutions.",1896333; ,"LOW, MALCOLM JAMES;","MAAS, STEFAN",7/1/1990,6/30/2021,Biology; System; Training Programs; ,Systems and Integrative Biology Training Program,8322,TWD,NIGMS Initial Review Group ,,,26,263256,13380,276636,0,1,1,2,TRUE
9115993,T32,HL,4,N,8/12/2016,9/1/2016,8/31/2018,839,T32HL069765,SCHOOLS OF MEDICINE,PA-11-184,4T32HL069765-15,NHLBI:391345\,"TRAINING, INSTITUTIONAL",2016,"NATIONAL HEART, LUNG, AND BLOOD INSTITUTE",,NASHVILLE,UNITED STATES,INTERNAL MEDICINE/MEDICINE,5,965717143,US,8721001,VANDERBILT UNIVERSITY,TN,372407749,"PROJECT NARRATIVE Inflammatory disorders of blood and vascular system are increasing as documented for sepsis ('blood poisoning') and cardiovascular infections, atherosclerosis (narrowing of blood vessels), high blood pressure, obesity-related metabolic syndrome and diabetes. To meet the rising tide of these disorders, we need to train a new generation of scientists and physician-scientists who will master inflammation as the mechanism of these diseases and respond to them by developing new diagnostic tools, preventive measures, and therapies to reduce the growing burden of these disorders.",1858438; ,"HAWIGER, JACK J;","CHANG, HENRY",4/1/2002,8/31/2018,Blood; Immunobiology; Training Programs; Vascular System; ,Immunobiology of Blood and Vascular Systems Training Program,69765,NITM,NHLBI Institutional Training Mechanism Review Committee ,,,15,400928,26954,391345,0,0,1,1,TRUE
8999564,T32,GM,2,N,6/23/2016,7/1/2016,6/30/2017,859,T32GM007185,SCHOOLS OF ARTS AND SCIENCES,PA-14-015,2T32GM007185-42,NIGMS:941469\,"TRAINING, INSTITUTIONAL",2016,NATIONAL INSTITUTE OF GENERAL MEDICAL SCIENCES,,LOS ANGELES,UNITED STATES,CHEMISTRY,33,92530369,US,577505,UNIVERSITY OF CALIFORNIA LOS ANGELES,CA,900952000,"PUBLIC HEALTH RELEVANCE     The UCLA Cellular and Molecular Biology (CMB) Training Program strives to produce the next generation of PhD cell and molecular biologists who reflect our diversity and ethical standards and who are poised to take full advantage of the developing new fields such as proteomics, systems biology, and bioinformatics to advance human health. The foundation of our program is the research training provided by our faculty, complemented by course work, seminars, and programs designed specifically for our trainees.",1863373; ,"CLARKE, STEVEN G;","GINDHART, JOSEPH G",7/1/1975,6/30/2021,Molecular and Cellular Biology; Research; ,Research Tranining in Cellular and Molecular Biology,7185,TWD,NIGMS Initial Review Group ,,,42,887947,53522,941469,1,0,1,2,TRUE
9060753,T32,HD,4,N,4/20/2016,5/1/2016,12/31/2017,865,T32HD052471,SCHOOLS OF VETERINARY MEDICINE,PA-11-184,4T32HD052471-10,NICHD:224434\,"TRAINING, INSTITUTIONAL",2016,EUNICE KENNEDY SHRIVER NATIONAL INSTITUTE OF CHILD HEALTH & HUMAN DEVELOPMENT,Contraception/Reproduction; Genetics; Human Genome; ,ITHACA,UNITED STATES,OTHER BASIC SCIENCES,23,872612445,US,1514802,CORNELL UNIVERSITY,NY,148502820,"The goal of this training Program is to continue to provide comprehensive and in-depth research training in the reproductive sciences, centrally integrating training in the tools of functional mammalian genomics/genetics and computational biology in order to address problems of world population, long-term sustainability and infertility. To this end, graduate and postdoctoral trainees will choose and be trained by dual mentors; the primary Trainer having expertise in the reproductive sciences and the Co-Trainer with expertise in genomics and/or computational biology.",1871532; ,"ROBERSON, MARK S;","TAYMANS, SUSAN",9/30/2007,12/31/2017,Genomics; Reproductive Biology; Training Programs; ,Reproductive Biology and Genomics Training Program,52471,ZHD1,Special Emphasis Panel ,,,10,222512,15693,224434,0,1,0,1,TRUE
